binomial,description
Tropidoclonion lineatum,"Tropidoclonion is a genus of snake in the subfamily Natricinae of the family Colubridae. The genus is monotypic, containing the sole species Tropidoclonion lineatum, commonly known as the lined snake. The species is native to the central United States. Additional common names for Tropidoclonion lineatum include common snake, dwarf garter snake, grass snake, line snake, ribbon snake, streaked snake, striped snake, and swamp snake."
Tropidolaemus subannulatus,"The Bornean keeled green pit viper or North Philippine temple pit viper (Tropidolaemus subannulatus) is a pit viper species native to Brunei, Indonesia, Malaysia, and the Philippines. Until 2007, this species was considered part of the Tropidolaemus wagleri species complex. The Borneo Keeled Green Pit Viper can have a range of colors but generally it is bright green with numerous thin crossbands. Some localities have a mixture of light green to blue background colors. The bands are variable and can be a combination of blue, red or white.  Females may have blue or red dots on their underbelly, while juveniles and males only have red dots. Females are much larger than males and can grow to a maximum size of 96 cm, while males can reach a size of 46 cm. This species is one of the most common species encountered in the lowland rainforests of Borneo.  It is known to eat birds, small mammals and frogs. It is ovoviparous and gives birth to live young."
Tropidolaemus wagleri,"Tropidolaemus wagleri, more commonly known as Wagler's pit viper, is a species of venomous snake, a pit viper in the subfamily Crotalinae of the family Viperidae. The species is endemic to Southeast Asia. There are no subspecies that are recognized as being valid. It is sometimes referred to as the temple viper because of its abundance around the Temple of the Azure Cloud in Malaysia. The specific name, wagleri, is in honour of German herpetologist Johann Georg Wagler."
Vipera ammodytes,"Vipera ammodytes, commonly known as horned viper, long-nosed viper, nose-horned viper, and sand viper, is a species of viper found in northern Italy, the Balkans, and parts of Asia Minor. Like all other vipers, it is venomous. It is reputed to be the most dangerous of the European vipers due to its large size, long fangs (up to 13 mm) and high venom toxicity. The specific name, ammodytes, is derived from the Greek words ammos, meaning ""sand"", and dutes, meaning ""burrower"" or ""diver"", despite its preference for rocky habitats. Five subspecies are currently recognized, including the nominate subspecies described here. V. ammodytes grows to an average total length (snout-tail) of 85 cm (33.5 in), although individuals usually measure less than 75 cm (29.5 in). Maximum length also depends on locality, with northern forms distinctly larger than southern ones. In one field study on Golem Grad island (in North Macedonia), for example, females averaged 35 cm., and males at 37 cm.; the largest captured during the study was a male, at 66 cm. long. This indicates some degree of regional or insular dwarfism."
Vipera aspis,"Vipera aspis is a viper species found in southwestern Europe. 
Its common names include asp, asp viper, European asp, and aspic viper, among others. Like all other vipers, it is venomous. Bites from this species can be more severe than from the European adder, V. berus; not only can they be very painful, but approximately 4% of all untreated bites are fatal. The specific epithet, aspis, is a Greek word that means ""viper."" Five subspecies are currently recognized, including the nominate subspecies described here. The species grows to an average total length of 60–65 centimetres (24–26 in). Males reach a maximum total length of 85 cm (33 in), females rarely more than 75 cm (30 in). Males, however, are a little slimmer than females. The tail is very short: one-seventh to one-ninth of total body length in females, and one-sixth to one-eighth in males."
Vipera seoanei,"Vipera seoanei is a venomous viper species native to extreme southwestern France and the northern regions of Spain and Portugal. Two subspecies are recognized as being valid, including the nominate race described here. The specific name, seoanei, is in honor of Spanish naturalist Víctor López Seoane y Pardo-Montenegro."
Virginia valeriae,"The smooth earth snake (Virginia valeriae) is a species of nonvenomous natricine colubrid snake native to the eastern half of the United States. The specific name or epithet, valeriae, is in honor of Valeria Biddle Blaney (1828–1900), who collected the first specimen in Kent County, Maryland, and was a first cousin of Spencer Fullerton Baird."
Xenochrophis piscator,"The checkered keelback (Fowlea piscator), also known commonly as the Asiatic water snake, is a common species in the subfamily Natricinae of the family Colubridae. The species is endemic to Asia. It is non-venomous. The eye of F. piscator is rather small and shorter than its distance from the nostril in the adult. Its rostral scale is visible from above. The internasal scales are much narrowed anteriorly and subtriangular, with the anterior angle truncated and as long as the prefrontal scales. The frontal scale is longer than its distance from the end of the snout, and as long as the parietals or a little shorter. The loreal is nearly as long as it is deep. There are one preocular and three (rarely four) post-oculars. Its temporals are 2+2 or 2+3. There are normally nine upper labials, with the fourth and fifth entering the eye; and five lower labials in contact with the anterior chin-shields, which are shorter than the posterior. The dorsal scales are arranged in 19 rows, strongly keeled, with outer rows smooth. The ventrals number 125–158, the anal is divided, and the subcaudals number 64–90. Coloration is very variable, consisting of dark spots arranged quincuncially and often separated by a whitish network, or of black longitudinal bands on a pale ground, or of dark crossbands, with or without whitish spots. Two oblique black streaks, one below and the other behind the eye, are nearly constant. The lower parts are white, with or without black margins to the shields."